{
  "$schema": "./schemas/requirements.schema.json",
  "schema_version": "rvt-qms-requirements-v1",
  "register_id": "RVT-QMS-REG-002",
  "register_revision": "R03",
  "effective_product_version": "16.5.7",
  "status": "active",
  "owner_role": "quality_manager",
  "requirements": [
    {
      "requirement_id": "RVT-QMS-001",
      "title": "Coordinated product identity",
      "statement": "Every shipped product carrier shall expose one authoritative semantic product version.",
      "source_refs": ["AGENTS.md#one-release-increment-per-pr"],
      "category": "quality",
      "risk_class": "high",
      "owner_role": "release_manager",
      "status": "active",
      "implementation_paths": [
        "pyproject.toml",
        "scripts/check-version-contract.mjs",
        "scripts/check-pr-version-bump.mjs"
      ],
      "verification_refs": [
        {
          "path": "scripts/check-version-contract.mjs",
          "selector": "Version contract valid",
          "kind": "ci_check"
        },
        {
          "path": "scripts/check-pr-version-bump.mjs",
          "selector": "PR release step valid",
          "kind": "ci_check"
        }
      ],
      "artifact_types": ["firmware_source", "trainer", "dashboard", "apk", "exe", "pwa"],
      "acceptance_criteria": [
        "All product carriers equal the authoritative X.Y.Z value.",
        "A product-affecting pull request advances exactly one patch or one minor."
      ],
      "change_record_required": true
    },
    {
      "requirement_id": "RVT-QMS-002",
      "title": "Controlled change record",
      "statement": "Every implementation commit shall update the engineering handoff, and every pull request shall identify requirements, risk, verification, migration, and rollback.",
      "source_refs": ["AGENTS.md#verification-protocol-every-commit", "quality/qms-policy.md#requirement-and-design-change-control"],
      "category": "quality",
      "risk_class": "high",
      "owner_role": "quality_manager",
      "status": "active",
      "implementation_paths": [
        "HANDOFF.md",
        ".github/PULL_REQUEST_TEMPLATE.md",
        "scripts/check-qms-contract.mjs"
      ],
      "verification_refs": [
        {
          "path": "scripts/check-qms-contract.mjs",
          "selector": "HANDOFF.md",
          "kind": "ci_check"
        }
      ],
      "artifact_types": ["change_record", "controlled_document", "release_record"],
      "acceptance_criteria": [
        "Each non-merge commit in the pull request changes HANDOFF.md.",
        "The pull request contains the required change-control sections and evidence."
      ],
      "change_record_required": true
    },
    {
      "requirement_id": "RVT-FW-001",
      "title": "Frozen serial acquisition contract",
      "statement": "Firmware and trainer shall preserve the 222-column v15.2 wire contract, the original 207-column prefix, and 219-column v15.1 replay compatibility.",
      "source_refs": ["AGENTS.md#serial-protocol-is-frozen"],
      "category": "firmware",
      "risk_class": "critical",
      "owner_role": "firmware_owner",
      "status": "active",
      "implementation_paths": [
        "radar_vital_v16_5_7.ino",
        "rvt_trainer/monolith.py"
      ],
      "verification_refs": [
        {
          "path": "tests/test_v12_static_contract.py",
          "selector": "test_frozen_serial_protocol_contract",
          "kind": "automated_test"
        },
        {
          "path": "tests/test_v12_static_contract.py",
          "selector": "test_trainer_pads_legacy_207_rows_to_v15_1_contract",
          "kind": "automated_test"
        }
      ],
      "artifact_types": ["firmware_source", "trainer", "session_csv"],
      "acceptance_criteria": [
        "The current firmware emits exactly 222 ordered columns.",
        "Legacy 207- and 219-column inputs remain readable without shifting contractual fields."
      ],
      "change_record_required": true
    },
    {
      "requirement_id": "RVT-SEC-001",
      "title": "Private material is not web-served",
      "statement": "TLS keys and other private material shall remain outside public assets and all traversal attempts into private storage shall be denied.",
      "source_refs": ["AGENTS.md#secrets-stay-out-of-assets"],
      "category": "security",
      "risk_class": "critical",
      "owner_role": "security_owner",
      "status": "active",
      "implementation_paths": [
        "rvt_trainer/assets/static.py",
        "rvt_trainer/api/route_registry/types.py",
        "rvt_trainer/monolith.py",
        ".gitignore"
      ],
      "verification_refs": [
        {
          "path": "tests/test_trainer_static.py",
          "selector": "test_safe_asset_path_blocks_rvt_tls_directly",
          "kind": "automated_test"
        },
        {
          "path": "tests/test_trainer_security_api.py",
          "selector": "/.rvt_tls/key.pem",
          "kind": "automated_test"
        },
        {
          "path": "tests/test_trainer_security_api.py",
          "selector": "test_head_never_falls_through_to_simple_http_file_serving",
          "kind": "automated_test"
        },
        {
          "path": "tests/test_trainer_route_registry.py",
          "selector": "test_route_wildcards_do_not_cross_path_segments",
          "kind": "automated_test"
        }
      ],
      "artifact_types": ["trainer", "dashboard", "pwa"],
      "acceptance_criteria": [
        "No private-key path resolves through the static asset router.",
        "Private TLS material is ignored by Git and absent from packaged web assets.",
        "Unsupported methods and malformed route segments cannot fall through to filesystem serving or protected handlers."
      ],
      "change_record_required": true
    },
    {
      "requirement_id": "RVT-SSE-001",
      "title": "Bounded SSE lifetime and warning",
      "statement": "The trainer shall warn exactly 60 seconds before the 12-hour SSE deadline and the dashboard shall reconnect without clobbering session state.",
      "source_refs": ["AGENTS.md#sse-telemetry-reconnect-contract"],
      "category": "trainer",
      "risk_class": "high",
      "owner_role": "trainer_owner",
      "status": "active",
      "implementation_paths": [
        "rvt_trainer/monolith.py",
        "web/src/app/services/sse-driver.service.ts"
      ],
      "verification_refs": [
        {
          "path": "tests/test_trainer_sse.py",
          "selector": "test_sse_deadline_warning_payload_is_exactly_sixty_seconds",
          "kind": "automated_test"
        },
        {
          "path": "web/src/app/services/telemetry.service.spec.ts",
          "selector": "rotates the one-use SSE token at the stream deadline without clearing session state",
          "kind": "automated_test"
        }
      ],
      "artifact_types": ["trainer", "dashboard", "session_record"],
      "acceptance_criteria": [
        "The warning event reason and seconds_remaining payload are exact.",
        "Reconnect retains active participant and session identity."
      ],
      "change_record_required": true
    },
    {
      "requirement_id": "RVT-SES-001",
      "title": "Participant and trial provenance",
      "statement": "Each study capture shall be immutably bound to one pseudonymous participant, trial condition, release identity, protocol identity, and model identity.",
      "source_refs": ["docs/system-feedback-loop.md#participant-and-thesis-condition-session-contract"],
      "category": "session",
      "risk_class": "critical",
      "owner_role": "research_lead",
      "status": "active",
      "implementation_paths": [
        "rvt_trainer/session/study_contract.py",
        "rvt_trainer/session/supervisor.py",
        "web/src/app/components/participant-study-setup/participant-study-setup.component.ts"
      ],
      "verification_refs": [
        {
          "path": "tests/test_participant_study_contract.py",
          "selector": "test_api_start_persists_release_bound_participant_manifest",
          "kind": "automated_test"
        },
        {
          "path": "tests/test_participant_study_contract.py",
          "selector": "test_confirmatory_contract_rejects_protocol_drift",
          "kind": "automated_test"
        },
        {
          "path": "web/src/app/components/participant-study-setup/participant-study-setup.component.spec.ts",
          "selector": "fails closed and clears a cached participant when the roster cannot be verified",
          "kind": "automated_test"
        }
      ],
      "artifact_types": ["session_manifest", "trainer", "dashboard", "statistical_report"],
      "acceptance_criteria": [
        "A started session cannot be reassigned to another participant or condition.",
        "Confirmatory eligibility requires the frozen protocol and complete provenance.",
        "Start remains disabled unless the selected participant is present and active in the current roster."
      ],
      "change_record_required": true
    },
    {
      "requirement_id": "RVT-COMP-001",
      "title": "Cross-release compatibility gate",
      "statement": "Known dashboard, trainer, firmware, protocol-width, or schema mismatches shall block real capture while incomplete legacy evidence remains explicitly unverified.",
      "source_refs": ["HANDOFF.md#2026-07-29---gate-v1653-release-compatibility-and-preserve-failed-starts"],
      "category": "session",
      "risk_class": "critical",
      "owner_role": "technical_lead",
      "status": "active",
      "implementation_paths": [
        "rvt_trainer/api/compatibility.py",
        "web/src/app/services/release-compatibility.service.ts"
      ],
      "verification_refs": [
        {
          "path": "tests/test_release_compatibility.py",
          "selector": "test_any_supplied_release_or_protocol_mismatch_blocks_start",
          "kind": "automated_test"
        },
        {
          "path": "tests/test_release_compatibility.py",